<?xml version="1.0" encoding="utf-8"?>

<xs:schema xmlns:xs="http://www.w3.org/2001/XMLSchema" elementFormDefault="qualified" attributeFormDefault="qualified">
	<xs:element name="users">
		<xs:complexType>
			<xs:sequence>
				<xs:element name="user" minOccurs="3" maxOccurs="unbounded">
					<xs:complexType>
						<xs:sequence>
							<xs:element name="firstname" type="xs:string"/>
							<xs:element name="lastname" type="xs:string"/>
							<xs:element name="profession" type="xs:string"/>
						</xs:sequence>
						<xs:attribute name="id" type="xs:unsignedShort" use="required"/>
					</xs:complexType>
				</xs:element>
			</xs:sequence>
		</xs:complexType>
	</xs:element>
</xs:schema>